{
  "schemaVersion": 2,
  "id": "dog-example-collection",
  "title": "Canine Example Collection",
  "speciesId": "dog",
  "systemId": "skeletal",
  "collectionId": "example-collection",
  "defaultViewId": "dog-example-view",
  "views": [
    {
      "id": "dog-example-view",
      "buttonLabel": "Example view",
      "dataPath": "data/views/dog-example-view.json"
    }
  ]
}
