{
  "schemaVersion": 2,
  "id": "dog-cervical-vertebrae",
  "title": "Canine Cervical Vertebrae",
  "speciesId": "dog",
  "systemId": "skeletal",
  "collectionId": "cervical-vertebrae",
  "defaultViewId": "dog-cervical-c1-dorsal",
  "views": [
    {
      "id": "dog-cervical-c1-dorsal",
      "buttonLabel": "C1 · Dorsal",
      "dataPath": "data/views/dog-cervical-c1-dorsal.json"
    }
  ]
}
